{
  "registry_version": 1,
  "release_id": "2.0.0-dev",
  "oracle_id": "stealth-release-oracle-v2",
  "oracle_digest": "7deac05210835f99c19f2a6dbaa2df44af24d3cf62bb8766b5b403c6038fff2e",
  "generated_at": "2026-07-17T00:00:00Z",
  "browser_scope": [
    {
      "family": "chromium",
      "exact_build": "150.0.7871.124",
      "platform": "darwin-arm64"
    },
    {
      "family": "firefox",
      "exact_build": "152.0.6",
      "platform": "darwin-arm64"
    }
  ],
  "entries": [
    {
      "id": "delta-about-blank-realm-canonical-wrapper-identity-wrapper-instanceof",
      "observation_id": "about-blank-realm/canonical-wrapper-identity.wrapper-instanceof",
      "exact_signature": {
        "surface": "about-blank-realm/canonical-wrapper-identity",
        "probe_id": "wrapper-instanceof",
        "native_digest": "b8192e3fc84951bdba855e7efa89280bc5586607191552239e476b78892aa405",
        "mediated_digest": "9fd8585e6d317957cedee8a8dcf59437481c7a550e3713e5f0c6fb40c3e0a3de"
      },
      "category": "intentional-security-boundary",
      "issue_url": "https://github.com/gosuda/zeroproxy/issues/new?title=Remove%20about-blank-realm%2Fcanonical-wrapper-identity.wrapper-instanceof%20delta",
      "owner": "runtime-security",
      "rationale": "A newly instrumented contained realm uses a canonical Window facade whose prototype cannot preserve raw cross-realm Window identity.",
      "affected_release_range": "2.0.0-dev",
      "affected_browser_builds": [
        {
          "family": "chromium",
          "exact_build": "150.0.7871.124",
          "platform": "darwin-arm64"
        },
        {
          "family": "firefox",
          "exact_build": "152.0.6",
          "platform": "darwin-arm64"
        }
      ],
      "introduced_at": "2026-07-17T00:00:00Z",
      "expires_at": "2026-10-01T00:00:00Z",
      "removal_condition": "Remove when wrapper-instanceof is native-equal in this exact context without exposing synthetic routing state or weakening mediation.",
      "test_id": "stealth-release-oracle-v2"
    },
    {
      "id": "delta-about-blank-realm-function-reflection-function-source-chromium",
      "observation_id": "about-blank-realm/function-reflection.function-source",
      "exact_signature": {
        "surface": "about-blank-realm/function-reflection",
        "probe_id": "function-source",
        "native_digest": "59fd3a967fefc75afe12c3bb24f6e5199d9d881bd3ce1997f2d84a0000365d8f",
        "mediated_digest": "deb3dc81a16eb24eb8665cf4dca8d4be2184b7250e1585047b35abb391a4d252"
      },
      "category": "intentional-security-boundary",
      "issue_url": "https://github.com/gosuda/zeroproxy/issues/new?title=Remove%20about-blank-realm%2Ffunction-reflection.function-source%20delta-chromium",
      "owner": "runtime-security",
      "rationale": "A pristine parent-realm Function.prototype observes the contained realm fetch wrapper source while the contained realm reflection surface remains native-shaped.",
      "affected_release_range": "2.0.0-dev",
      "affected_browser_builds": [
        {
          "family": "chromium",
          "exact_build": "150.0.7871.124",
          "platform": "darwin-arm64"
        }
      ],
      "introduced_at": "2026-07-17T00:00:00Z",
      "expires_at": "2026-10-01T00:00:00Z",
      "removal_condition": "Remove when function-source is native-equal in this exact context without exposing synthetic routing state or weakening mediation.",
      "test_id": "stealth-release-oracle-v2"
    },
    {
      "id": "delta-about-blank-realm-function-reflection-function-source-firefox",
      "observation_id": "about-blank-realm/function-reflection.function-source",
      "exact_signature": {
        "surface": "about-blank-realm/function-reflection",
        "probe_id": "function-source",
        "native_digest": "bf59ca36f197fccd78cb8c53dda65285bfd2a0f3625dd7caa6ef48db941cc5fa",
        "mediated_digest": "deb3dc81a16eb24eb8665cf4dca8d4be2184b7250e1585047b35abb391a4d252"
      },
      "category": "intentional-security-boundary",
      "issue_url": "https://github.com/gosuda/zeroproxy/issues/new?title=Remove%20about-blank-realm%2Ffunction-reflection.function-source%20delta-firefox",
      "owner": "runtime-security",
      "rationale": "A pristine parent-realm Function.prototype observes the contained realm fetch wrapper source while the contained realm reflection surface remains native-shaped.",
      "affected_release_range": "2.0.0-dev",
      "affected_browser_builds": [
        {
          "family": "firefox",
          "exact_build": "152.0.6",
          "platform": "darwin-arm64"
        }
      ],
      "introduced_at": "2026-07-17T00:00:00Z",
      "expires_at": "2026-10-01T00:00:00Z",
      "removal_condition": "Remove when function-source is native-equal in this exact context without exposing synthetic routing state or weakening mediation.",
      "test_id": "stealth-release-oracle-v2"
    },
    {
      "id": "delta-about-blank-realm-global-equality-window-location",
      "observation_id": "about-blank-realm/global-equality.window-location",
      "exact_signature": {
        "surface": "about-blank-realm/global-equality",
        "probe_id": "window-location",
        "native_digest": "b5bea41b6c623f7c09f1bf24dcae58ebab3c0cdd90ad966bc43a45b44867e12b",
        "mediated_digest": "fcbcf165908dd18a9e49f7ff27810176db8e9f63b4352213741664245224f8aa"
      },
      "category": "intentional-security-boundary",
      "issue_url": "https://github.com/gosuda/zeroproxy/issues/new?title=Remove%20about-blank-realm%2Fglobal-equality.window-location%20delta",
      "owner": "runtime-security",
      "rationale": "Document.location returns the synthetic Location facade so target code cannot recover the network-facing synthetic URL.",
      "affected_release_range": "2.0.0-dev",
      "affected_browser_builds": [
        {
          "family": "chromium",
          "exact_build": "150.0.7871.124",
          "platform": "darwin-arm64"
        },
        {
          "family": "firefox",
          "exact_build": "152.0.6",
          "platform": "darwin-arm64"
        }
      ],
      "introduced_at": "2026-07-17T00:00:00Z",
      "expires_at": "2026-10-01T00:00:00Z",
      "removal_condition": "Remove when window-location is native-equal in this exact context without exposing synthetic routing state or weakening mediation.",
      "test_id": "stealth-release-oracle-v2"
    },
    {
      "id": "delta-about-blank-realm-internal-url-concealment-raw-runtime-urls",
      "observation_id": "about-blank-realm/internal-url-concealment.raw-runtime-urls",
      "exact_signature": {
        "surface": "about-blank-realm/internal-url-concealment",
        "probe_id": "raw-runtime-urls",
        "native_digest": "b5bea41b6c623f7c09f1bf24dcae58ebab3c0cdd90ad966bc43a45b44867e12b",
        "mediated_digest": "fcbcf165908dd18a9e49f7ff27810176db8e9f63b4352213741664245224f8aa"
      },
      "category": "intentional-security-boundary",
      "issue_url": "https://github.com/gosuda/zeroproxy/issues/new?title=Remove%20about-blank-realm%2Finternal-url-concealment.raw-runtime-urls%20delta",
      "owner": "runtime-security",
      "rationale": "The newly instrumented about:blank realm records its trusted runtime bootstrap resource before the contained performance projection is installed.",
      "affected_release_range": "2.0.0-dev",
      "affected_browser_builds": [
        {
          "family": "chromium",
          "exact_build": "150.0.7871.124",
          "platform": "darwin-arm64"
        },
        {
          "family": "firefox",
          "exact_build": "152.0.6",
          "platform": "darwin-arm64"
        }
      ],
      "introduced_at": "2026-07-17T00:00:00Z",
      "expires_at": "2026-10-01T00:00:00Z",
      "removal_condition": "Remove when raw-runtime-urls is native-equal in this exact context without exposing synthetic routing state or weakening mediation.",
      "test_id": "stealth-release-oracle-v2"
    },
    {
      "id": "delta-about-blank-realm-performance-observability-resource-timing",
      "observation_id": "about-blank-realm/performance-observability.resource-timing",
      "exact_signature": {
        "surface": "about-blank-realm/performance-observability",
        "probe_id": "resource-timing",
        "native_digest": "b5bea41b6c623f7c09f1bf24dcae58ebab3c0cdd90ad966bc43a45b44867e12b",
        "mediated_digest": "fcbcf165908dd18a9e49f7ff27810176db8e9f63b4352213741664245224f8aa"
      },
      "category": "intentional-security-boundary",
      "issue_url": "https://github.com/gosuda/zeroproxy/issues/new?title=Remove%20about-blank-realm%2Fperformance-observability.resource-timing%20delta",
      "owner": "runtime-security",
      "rationale": "The newly instrumented about:blank realm records its trusted runtime bootstrap resource before the contained performance projection is installed.",
      "affected_release_range": "2.0.0-dev",
      "affected_browser_builds": [
        {
          "family": "chromium",
          "exact_build": "150.0.7871.124",
          "platform": "darwin-arm64"
        },
        {
          "family": "firefox",
          "exact_build": "152.0.6",
          "platform": "darwin-arm64"
        }
      ],
      "introduced_at": "2026-07-17T00:00:00Z",
      "expires_at": "2026-10-01T00:00:00Z",
      "removal_condition": "Remove when resource-timing is native-equal in this exact context without exposing synthetic routing state or weakening mediation.",
      "test_id": "stealth-release-oracle-v2"
    },
    {
      "id": "delta-about-blank-realm-root-injection-concealment-root-descriptor-graph",
      "observation_id": "about-blank-realm/root-injection-concealment.root-descriptor-graph",
      "exact_signature": {
        "surface": "about-blank-realm/root-injection-concealment",
        "probe_id": "root-descriptor-graph",
        "native_digest": "b594ff8e1c696eed43d7982bcc36e0a57442b87b92fe233f9fbc5ef96d92d8e1",